<?xml version="1.0" encoding="UTF-8"?>
<!-- XML Sample Message of message hierarchy                                          -->
<!-- Message:             ADC GL Account Segment v1.0 Rev. 5                          -->
<!-- Transaction:         AA - Audit Data Collection Rev. 271                         -->
<!-- Datamodel:           Audit Data Collection Datamodel, version HEAD Rev. 347      -->
<!-- XML tagset used:     AdcsML                                                      -->
<!-- Generated at:        02-05-2021 15:53:55                                         -->
<!-- Generated using:     EC-Design 2.5.0 (http://www.ec-design.nl)                   -->
<!-- Generated by:        Jan Vrijenhoek (Digitect)                                   -->
<!-- Organisation:        Digitect B.V. (Digitect)                                    -->
<!-- NOTE:    This sample message was generated automatically: manual modifications will be lost -->
<AdcGlAccountSegment xsi:schemaLocation="http://schemas.iso.org/AdcsML/Messages/AdcGlAccountSegment-v1 AdcGlAccountSegment.xsd"
		xmlns="http://schemas.iso.org/AdcsML/Messages/AdcGlAccountSegment-v1"
		xmlns:xsi="http://www.w3.org/2001/XMLSchema-instance">
	<GlAcntSg>
		<GlAcntNr>ACC123456789</GlAcntNr>
		<AcntSgNr>0</AcntSgNr>
		<AcntSgNm>Sales and Purchase</AcntSgNm>
		<CorrFile>BAS_Customized_ACC_Segment</CorrFile>
		<AcntSgDscr>Sales and purchase provit.</AcntSgDscr>
		<CstmzdAccSgCd>AS1</CstmzdAccSgCd>
	</GlAcntSg>
</AdcGlAccountSegment>
